objectid,title,format,filename,date,subject,location,latitude,longitude,description
item53,St.Catharines Map 10,image/jpeg,St_Catharines_10.jpg,,Welland Canal;Survey Map,St.Catharines,,,Survey map of the Second Welland Canal created by the Welland Canal Company along the western edge of the Town of St. Catharines. Although not labelled the Second Welland Canal can be seen running through the map along with its tow path which is located on the southwestern edge of the waterway. The surveyors' measurements and notes can be seen in red and black ink and pencil. Local area landmarks are identified and include streets and roads (ex. Ontario Street and Road to Hamilton): Artesian Mineral Well: Dr. Mack's Artesian Well: Stephenson House Mineral Well and Gas Works: New Brewery: Old Brewery: Welland House Mineral Well: L. Shickluna's Shipyard: Vinegar Manufactory: Merritt's Covered Race: Mitchels Wharf: Sail Loft: an office: a tavern: two barns: a boathouse: a structure belonging to T. Nihan (or P. Nihen): and some store houses. Properties and property owners of note are: Concession 6 Lot 20: William H. Merritt: E. S. Adams: William Chace: Jacob Hainer: J. Taylor: and J. P. Merritt.
item54,Through Grantham Township Map 7,image/jpeg,Through_Grantham_Township_7.jpg,,Welland Canal;Survey Map;Grantham,,,,Survey map of the Second Welland Canal created by the Welland Canal Company showing a portion of the Grantham Township. Identified structures associated with the Canal include the floating tow path. The surveyors' measurements and notes can be seen in red and black ink and pencil. Local area landmarks are also identified and include streets and roads (ex. Road to Port Dalhousie and Road to St. Catharines): Georges Point: Browns Island: and an unnamed island. Properties and property owners of note are: Concession 2 Lots 21 and 22: Concession 3 Lots 21 and 22: John Clark: C. May: George May: and J. R. Tenbroeck.
item55,Through Grantham and Louth Townships Map 8,image/jpeg,Grantham_Louth_Townships_8.jpg,,Welland Canal;Survey Map;Grantham;Louth,,,,Survey map of the Second Welland Canal created by the Welland Canal Company showing the area between the Townships of Louth and Grantham. Identified structures associated with the Canal include the floating tow path. It is not labelled but runs along the bottom of the map. The surveyors' measurements and notes can be seen in red and black ink and pencil. Local area landmarks that are identified include streets and roads (ex. New Road and Road to Port Dalhousie) and an unnamed bridge along New Road. Richardson's Creek is identified in pencil. Properties and property owners of note are: Lot 23 in Grantham Township: Lots 1 and 2 in Louth Township: John Bonner: John Martindale: Geo. E. Read: Thomas Read: N. Pawling: and the Board of Works.
item56,Through Grantham and Louth Townships Map 6,image/jpeg,Grantham_Louth_Townships_6.jpg,,Welland Canal;Survey Map;Grantham;Louth,,,,Survey map of the Second Welland Canal created by the Welland Canal Company showing the area between the Townships of Grantham and Louth. Identified structures associated with the Canal include the floating tow path. The surveyors' measurements and notes can be seen in red and black ink and pencil. Features of the First Welland Canal are noted in red ink and include the old towing path and the original bed of the Twelve Mile Creek. Local area landmarks are also identified and include streets and roads (ex. New Road and 1st Concession Road and an unnamed road in the top right corner): an unnamed bridge along New Road: J. Martindale's House: an Old Saw Mill: Richardsons Creek: Georges Point and an oak tree at Georges Point. Properties and property owners of note are: Concession 2 Lot 23 and Concession 3 Lot 23 in the Grantham Township: Concession 2 Lots 1 and 2 and Concession 3 Lots 1 and 2 in the Louth Township: Peter Weaver: J. Martindale and John Bonner. A property belonging to the Board of Works is outlined in red at Georges Point.
item57,Through Grantham Township Map 5,image/jpeg,Grantham_Township_5.jpg,,Welland Canal;Survey Map;Grantham,,,,Survey map of the Second Welland Canal created by the Welland Canal Company showing a portion of the Grantham Township near Port Dalhousie. Identified structures associated with the Canal include the tow path and floating tow path. The surveyors' measurements and notes can be seen in red and black ink and pencil. Features of the First Welland Canal are noted in red ink and include the old towing path: the Old Canal: two unnamed bridges traversing the Old Canal: and the bed of the Twelve Mile Creek. Local area landmarks are also identified and include streets and roads (ex. Old Road and Side Line and Road to Port Dalhousie): Samuel Wood's house: Peter Weaver's house: J. R. Tenbroeck's house: a poplar and walnut tree along the east shore: an oak and hickory tree along the west shore and a walnut tree stump along the west shore. Properties and property owners of note are: Concession 3 Lots 21 22 and 23: Concession 4 Lots 21 22 and 23: Adam Gould: Samuel Wood: Peter Weaver: and John R. Tenbroeck.
item58,Old Lock 2 in Grantham Township,image/jpeg,Old_Lock2_Grantham.jpg,,Welland Canal;Survey Map;Locks;Grantham,,,,Survey map of the Second Welland Canal created by the Welland Canal Company showing a portion of the Grantham Township near Port Dalhousie. Identified structures associated with the Canal include the new towing path. The surveyors' measurements and notes can be seen in red and black ink and pencil. Features of the First Welland Canal are noted in red ink and include the old Lock 2 and old towing path and the original bed of the Twelve Mile Creek. Local area landmarks are also identified and include streets and roads (ex. Side Line and Old Road): four unnamed bridges and a tree stump along the old towing path. A New Road to Port Dalhousie is featured in red ink. Properties and property owners of note are: Concession 3 Lots 21 22 and 23: Concession 4 Lots 21 22 and 23: Jabez Johnson: Adam Gould: Peter Weaver and Samuel Wood.
item59,Through Grantham Township Map 4,image/jpeg,Through_Grantham_Township_4.jpg,,Welland Canal;Survey Map;Grantham,,,,Survey map of the Second Welland Canal created by the Welland Canal Company showing a portion of the Grantham Township. Identified structures associated with the Canal include the floating tow path and the canal itself. The surveyors' measurements and notes can be seen in red and black ink and pencil. Features of the First Welland Canal are noted in red ink and include the old towing path. Local area landmarks are also identified and include streets and roads (ex. Line between Wood and Tenbroeck): an unnamed bridge: a poplar tree and walnut tree along the east shore. Properties and property owners of note are: Concession 4 Lot 22: Samuel Wood and John R. Tenbroeck.
item60,Lock 1 and Port Dalhousie,image/jpeg,Lock1_Port_Dalhousie.jpg,,Welland Canal;Survey Map;Locks,Port Dalhousie,,,Survey map of the Second Welland Canal created by the Welland Canal Company showing the areas in and around Port Dalhousie and Grantham Township. Identified structures associated with the Canal include Lock 1: East and West Piers: Collector's Office: Lock Tender's House and the new towing path. The surveyors' measurements and notes can be seen in red and black ink and pencil. Local area landmarks and businesses are also identified and include streets and roads (ex. Road to St. Catharines: Side Line: Old Road to Port Dalhousie and Road to Niagara): the Welland Railway and its structures (ex. freight sheds: wood shed: raised platform: elevator: cranes: water tank: turn table: and passenger station): G. A. Clark's Wood Yard: Clark's Wood Office: Alex Muir's Dry Dock: Donald Andrews and Ross' Dry Dock: RandJ Laurie Flouring Mill: R. Laurie and Company Grist Mill and A. Morrison Saw Mill. A New Road to St. Catharines is featured in red ink. Properties and property owners of note are: Concession 1 Lots 19 20 and 21: John Christie and John Clark.
item61,Entrance Lock 1 and Port Dalhousie,image/jpeg,Entrance_Lock1_Port_Dalhousie.jpg,,Welland Canal;Survey Map;Locks,Port Dalhousie,43.19997,-79.27373,Survey map of the Second Welland Canal created by the Welland Canal Company showing the areas in and around Port Dalhousie and Grantham Township. Identified structures associated with the Canal include Lock 1: Lighthouse: Lighthouse Keeper's House: East and West Piers: Harbour: Waste Weir: Store House: Collector's Office: Collector Assistant Office: Lock Tender's House and the new towing path. Features of the First Welland Canal are noted in red ink and includes the old Harbour: old Lock 1: old towing path and the original bed of the Twelve Mile Creek. The surveyors' measurements and notes can be seen in red and black ink and pencil. Local area landmarks and businesses are also identified and include streets and roads (ex. Lock Street and Colonel Clark's Cattle Road): Alex Muir's Dry Dock: RandJ Laurie Flouring Mill: R. Laurie and Company Grist Mill: A. Morrison Saw Mill: Johnson's Tavern: a store and a church. Properties and property owners of note are: Concession 1 Lots 21 and 22: John Christie: John Clark: N. Pawling: William Pawling: W. Carter: G.A. Clark: J. Maven: Mrs. Wood: James Drabble and J. Woodall.
item62,Welland Canal Survey of Lands Oliver Phelps,image/jpeg,Oliver_Phelps_1832.jpg,1832,Welland Canal;Survey Map,,,,Survey map and description of Oliver Phelp's land created by The Welland Canal Company. Included is a written description of the land along with a drawing of the land. Notable features include Vanderburgh's land: hydraulic ditch: locks 15-20: and lot divisions. The land totals 50 acres. The deed for the land is dated June 8th 1832. Surveyor notes are seen in pencil on the map.  See also page 161. Please note the measurments listed under overall dimensions are for the text only if the text appears on a seperate page from the drawing.
item63,Welland Canal Survey of Lands Jacob Neff Jr.,image/jpeg,Jacob_Neff_1835.jpg,1835,Welland Canal;Survey Map,,,,Survey map and description of Jacob Neff Jr's land created by The Welland Canal Company. Included is a written description of the land along with a drawing of the land. Notable features include the canal and the line between Jacob Neff and Jacob Augustine's land. The land totals 14 acres and 1 road. The deed for the land is dated June 24 1835. Surveyor notes are seen in pencil on the map.
item64,Welland Canal Survey of Lands Abraham Neff,image/jpeg,Abraham_Neff_1836.jpg,1836,Welland Canal;Survey Map,,,,Survey map and description of Abraham Neff's land created by The Welland Canal Company. Included is a written description of the land along with a drawing of the land. Notable features include: line between A. Neff and Jacob Neff's land: line between lots: canal and bridge. The land totals 7 acres. The deed for the land is dated October 25 1836. Surveyor notes are seen in pencil on the map.
item65,Welland Canal Survey of Lands Jacob Augustine,image/jpeg,Jacob_Augustine_1837.jpg,1837,Welland Canal;Survey Map,,,,Survey map and description of Jacob Augustine's land created by The Welland Canal Company. Included is a written description of the land along with a drawing of the land. The land surveyed is lot #27 in Humberstone. Notable features include: canal: concession: and line between Neff and J. Augustine's land. The land totals 8 acres. Surveyor notes are seen in pencil on the map.
item66,Welland Canal Survey of Lands Michael and Jacob Silverthorn,image/jpeg,Silverthorn_1834.jpg,1834,Welland Canal;Survey Map,,,,Survey map and description of Michael and Jacob Silverthorn's land created by The Welland Canal Company. Included is a written description of the land along with a drawing of the land. Notable features include: line between Burger and Silverthorn's land: reservoir: wood land: road leading to Quaker settlement: and line between Jacob and Michael Silverthorn's land. The deeds for both lands are dated September 25 1834. Surveyor notes are seen in pencil on the map.
item67,Welland Canal Survey of Lands Abraham Augustine,image/jpeg,Abraham_Augustine_1837.jpg,1837,Welland Canal;Survey Map,,,,Survey map and description of Jacob Augustine's land created by The Welland Canal Company. Included is a written description of the land along with a drawing of the land. The land surveyed is lot #26 in Humberstone.  Notable features include: canal: concession: and line between Abraham and Jacob Augustine's land. The land totals 7 1/4 acres. Surveyor notes are seen in pencil on the map.
item68,Welland Canal Survey of Lands Jacob Neff Sr.,image/jpeg,Jacob_Neff_Sr.jpg,,Welland Canal;Survey Map,,,,Survey map and description of Jacob Neff Sr.'s land created by The Welland Canal Company. Included is a written description of the land along with a drawing of the land. Notable features include: canal: line between lots: and line between Augustine and Jacob Neff's lots. The land totals 33 acres 1 road and 32 perches. Surveyor notes are seen in pencil on the map.
item69,Welland Canal Survey of Lands John Hellems,image/jpeg,John_Hellems_1835.jpg,1835,Welland Canal;Survey Map,,,,Survey map and description of John Hellem's land created by The Welland Canal Company. Included is a written description of the land along with a drawing of the land. Notable features include: W. Crooks land: concession lines: basin: bridges: guard lock: reservoir: tow path: and Lyons Creek. The survey was done on three seperate ocassions by George and Samuel Keefer for Hellems lot #26 in Crowland township. Surveyor notes are seen in pencil and red pen on the map.
item70,Welland Canal Survey of Lands David Price,image/jpeg,David_Price_1834.jpg,1834,Welland Canal;Survey Map,,,,Survey map and description of David Price's land created by The Welland Canal Company. Included is a written description of the land along with a drawing of the land. Notable features include: Hellem's Creek: road: bridge: Chippewa: Griffith's land: and canal. The deed for the land is dated October 14 1834. The land totals 5 acres 3 roads and 7 perches. Surveyor notes are seen in pencil and red pen on the map.
item71,Welland Canal Survey of Lands Jesse Wilson,image/jpeg,Jesse_Wilson_1834.jpg,1834,Welland Canal;Survey Map,,,,Survey map and description of Jesse Willson's land created by The Welland Canal Company. Included is a written description of the land along with a drawing of the land. Notable features include: Welland river: aquaduct: canal and place of beginning. The deed for the land is dated July 12 1834. The land totals 4 acres 0 roads and 20 perches. Surveyor notes are seen in pencil on the map.
item72,Welland Canal Survey of Lands Smith Shotwell,image/jpeg,Smith_Shotwell_1834.jpg,1834,Welland Canal;Survey Map,,,,Survey map and description of Smith Shotwell's land created by The Welland Canal Company. Included is a written description of the land along with a drawing of the land. Notable features include: the Welland River: and road. The deed for the land is dated October 14 1834. The land totals 10 acres 3 roads and 10 perches. Surveyor notes are seen in pencil on the map.
item73,Welland Canal Survey of Lands Joseph Burger,image/jpeg,Joseph_Burger.jpg,,Welland Canal;Survey Map,,,,Survey map and description of Joseph Burger's land created by The Welland Canal Company. Included is a written description of the land along with a drawing of the land. Notable features include: line between Silverthorn and Burger's land and line between Burger and Shotwell's land. The land totals 15 acres 1 road and 15 perches. Surveyor notes are seen in pencil on the map.
item74,Welland Canal Survey of Lands Jonathan Silverthorn,image/jpeg,Jonathan_Silverthorn_1834.jpg,1834,Welland Canal;Survey Map,,,,Survey map and description of Jonathan Silverthorn's land created by The Welland Canal Company. Included is a written description of the land along with a drawing of the land. The lands surveyed include lots 229 and 230. The land was first surveyed in 1830 and then again in 1834 by George Keefer. The original survey only included the feeder and resevoir and wood land whereas the second survey shows all lands owned by Silverthorn. The land totals 19.2 acres 2 roads and 32 perches. The land is broken down as follows: 7.6 acres cleared land: canal and towpath: 6.6 acres reservoir - Michael Silverthorn: 5 acres woodland. Surveyor notes are seen in pencil and red pen on the map.  See also page 138.
item75,Welland Canal Survey of Lands Elijah Shotwell,image/jpeg,Elijah_Shotwell_1834.jpg,1834,Welland Canal;Survey Map,,,,Survey map and description of Elijah Shotwell's land created by The Welland Canal Company. Included is a written description of the land along with a drawing of the land. Notable features include the road to Quaker settlement and line between Shotwell and Marr's land. The first survey was done in 1830 by George Keefer and a second survey done in 1834 once the water had reached its full head. The second survey is indicated in red on the original survey. Lots surveyed are no. 223 and 224. The deed for the land is dated November 3 1834. Surveyor notes are seen in pencil and red pen on the map.  See also page 138.
item76,Welland Canal Survey of Lands Alem Marr,image/jpeg,Alem_Marr_1834.jpg,1834,Welland Canal;Survey Map,,,,Survey map and description of Alem Marr's land created by the Welland Canal Company. Included is a written description of the land along with a drawing of the land. Notable features include: line between Marr and Shotwell's land and road allowance. The land totals 10 acres 1 road and 28 perches. The land was first surveyed in 1830 by George Keefer before the water had risen to its full head. The red lines on the survey indicate the corrected survey in 1834. Surveyor notes are seen in red pen on the map.
item77,Welland Canal Survey of Lands John Heslop's Estate,image/jpeg,John_Heslop.jpg,,Welland Canal;Survey Map,,,,Survey map and description of John Heslop's Estate's land created by the Welland Canal Company. Included is a written description of the land along with a drawing of the land. Notable features include the line between Heslop and Carrol's land. The land totals 11 acres 2 roads and 36 perches. The survey contains the land on the West side of the resovoir as well as the land drowned by the resevoir. Surveyor notes are seen in pencil on the map.
item78,Welland Canal Survey of Lands Widow McAlpine,image/jpeg,Widow_McAlpine.jpg,,Welland Canal;Survey Map,,,,Survey map and description of Widow McAlpine's land created by The Welland Canal Company. Included is a written description of the land along with a drawing of the land. Notable features include: line between Carl and Widow McAlpine: and line between McAlpine and D. Thompson Esq. The land totals 15 acres and 32 perches. Surveyor notes are seen in pencil on the map.
item79,Welland Canal Survey of Lands David Thompson,image/jpeg,David_Thompson.jpg,,Welland Canal;Survey Map,,,,Survey map and description of David Thompson's land created by The Welland Canal Company. Included is a written description of the land along with a drawing of the land. Notable features include a line between Widow McAlpine and Thompson's land. The land contains 9 acres 3 roads 11 perches and 2 acres partly drained.
item80,Welland Canal Survey of Lands John Watson,image/jpeg,John_Watson_1831.jpg,1831,Welland Canal;Survey Map,,,,Survey map and description of John Watson's land created by The Welland Canal Company. Included is a written description of the land along with a drawing of the land. The land totals 2 acres 1 road and 21 perches. The land was surveyed on September 5th 1831.
item81,Welland Canal Survey of Lands John Brown,image/jpeg,John_Brown_1827.jpg,1827,Welland Canal;Survey Map,,,,Survey map and description of John Brown's land created by the Welland Canal Company. Included is a written description of the land along with a drawing of the land. Notable features include: Welland river: towpath: canal: lock: side line between Broan and Carl. The land totals 6 acres 3 roads and 33 perches. The deed for the land is dated April 2 1827. Surveyor notes are seen in pencil on the map.
item82,Welland Canal Survey of Lands Garrett Vanderburgh,image/jpeg,Garrett_Vanderburgh_1826.jpg,1826,Welland Canal;Survey Map,,,,Survey map and description of Garret Vanderburgh's land created by the Welland Canal Company. Included is a written description of the land along with a drawing of the land. Notable features include the division between Swayze and Carl's land. The deed for the land is dated November 9th 1826. The land totals 36 acres and 26 perches. Surveyor notes are seen in pencil on the map.
item83,Welland Canal Survey of Lands Samuel Swayze,image/jpeg,Samuel_Swayze_1827.jpg,1827,Welland Canal;Survey Map,,,,Survey map and description of Samuel Swayze's land created by the Welland Canal Company. Included is a written description of the land along with a drawing of the land. Notable features include lot division. The land totals 65 acres and 12 perches. The deed from Hall Davis to the Welland Canal Company is dated December 1 1827. Surveyor notes are seen in pencil on the map.
item84,Welland Canal Survey of Lands Peter Vanevery,image/jpeg,Peter_Vanevery_1827.jpg,1827,Welland Canal;Survey Map,,,,Survey map and description of Peter Vanevery's land created by the Welland Canal Company. Included is a written description of the land along with a drawing of the land. Notable features include: lines between lots and L. Carrol's and E. Bouke's land. The land totals 100 acres. Deed from Jacob Stule (?) dated July 10 1827. Surveyor notes are seen in pencil on the map.
item85,Welland Canal Survey of Lands William McLellan,image/jpeg,William_McLellan.jpg,,Welland Canal;Survey Map,,,,Survey map and description of William McLellan's land created by the Welland Canal Company. Included is a written description of the land along with a drawing of the land. Notable features include lines between lots and the canal. Surveyor notes are seen in pencil on the map.
item86,Welland Canal Survey of Lands Zachariah Rykert,image/jpeg,Zachariah_Rykert_1827.jpg,1827,Welland Canal;Survey Map,,,,Survey map and description of Zachariah Rykert's land created by The Welland Canal Company. Included is a written description of the land along with a drawing of the land. Notable features include the line between Rykert and Parnell's land and lot divisions. The land totals 5.5 acres. Surveyor notes are seen in pencil on the map.
item87,Welland Canal Survey of Lands John Soper,image/jpeg,John_Soper_1826.jpg,1826,Welland Canal;Survey Map,,,,Survey map and description of John Soper's land created by the Welland Canal Company. Included is a written description of the land along with a drawing of the land. Notable features include: line between lots: high water mark of canal: and concession line. The land totals 1 acre. The survey was signed and submitted on August 23 1826.
item88,Welland Canal Survey of Lands Isabella Steward and William Sanderson,image/jpeg,Steward_and_Sanderson_1826.jpg,1826,Welland Canal;Survey Map,,,,The first survey map and description is of Isabella Steward's land created by the Welland Canal Company. Included is a written description of the land along with a drawing of the land. Notable features include the high water mark. The survey was signed and submitted on August 23rd 1826. The land totals 1/4 of an acre. The second survey map and description is of William Sanderson's land created by the Welland Canal Company. Included is a written description of the land along with a drawing of the land. Notable features include: line between Sanderson and Clendenning's land: line between Sanderson and Adam's land: and the canal. The survey was signed and submitted on August 23 1826. The land totals 14 perches and 1 road. Surveyor notes are seen in pencil on the map. This image contains two seperate surveys.
item89,Welland Canal Survey of Lands Francis Goring Parnell,image/jpeg,Francis_Goring_Parnell_1826.jpg,1826,Welland Canal;Survey Map,,,,Survey map and description of Francis Goring Parnell's land created by the Welland Canal Company. Included is a written description of the land along with a drawing of the land. Notable features include the line between Widow Secord and Parnell's land and the line between Rykert and Parnell's land. The deed for the land is dated December 5th 1826. The land totals 4 acres 1 road and 6 perches. Surveyor notes are seen in pencil on the map.
item90,Welland Canal Survey of Lands Elias Adams,image/jpeg,Elias_Adams.jpg,,Welland Canal;Survey Map,,,,Survey map and description of Elias Adam's land created by the Welland Canal Company. Included is a written description of the land along with a drawing of the land. The land was used for hydraulic purposes. Notable features include: line between Adams and Sanderson's land: line between Adams and Chisholm's land: and the canal. The land totals 1 acre and 10 perches. Surveyor notes are seen in pencil on the map.
item91,Welland Canal Survey of Lands William C. Chace,image/jpeg,William_Chace_1826.jpg,1826,Welland Canal;Survey Map,,,,Survey map and description of William C. Chace's land created by The Welland Canal Company. Included is a written description of the land along with a drawing of the land. Notable features include the concession line. The land totals 1/4 of an acre. The survey was signed and submitted on August 23 1826. Surveyor notes are seen in pencil on the map.
