objectid,title,format,filename,date,subject,location,latitude,longitude,description
item28,Canal to Chippewa Creek with Port Robinson Map 2,image/jpeg,Canal_Chippewa_Creek_Port_Robinson_2.jpg,,Welland Canal;Survey Map;Chippewa Creek,Port Robinson,,,Survey map of the Second Welland Canal created by the Welland Canal Company showing the canal as it passes through Port Robinson. Identified structures associated with the Canal include the Guard Lock: Collector Toll Office: towing path: and the New Cut of the canal. The surveyors' measurements and notes can be seen in red and black ink and pencil. Local area landmarks are also identified and include streets and roads (ex. Island Street: Bridge Street: John Street and Cross Street): bridges (Swing Bridge and several unnamed bridges): Welland Railroad: Canal to Chippewa Creek (and two old locks and one new lock associated with the canal): Chippewa Creek: Back Water: an unnamed Island: Dry Dock leased to McFarland and Abbey: Abbey's Office: D. McFarland and Co. Saw Mill (Burnt): G. Jordan Tavern: Robert Elliot Store House and Wharf: Isaac Pew's Shop: Colemans Hotel: R. Band and Co. Girst Mill: Donaldson and Co. Grist Mill: H. Marlatt Dwelling House and barn: Henry W. Timms Hotel: Methodist Church: Post Office: Blacksmith Shop: a church: a structure labeled B. Patch: and a number of other structures that are not named. Properties and property owners of note are: Lots 202 and 203: S. Hill: D. McFarland: Church Society: G. Jordan: D. Coleman: John Brown: Rob Coulter: Robert Elliot: Isaac Pew: James McCoppen: William Bell: Charles Stuart: Andrew Elliot: Robert Band: Ed. Feney: John Betty: F. Sharp: William B. Hendershot: A. Brownson: H. Marlatt: J. S. Powell: and the School Trustees. Two reserved properties are labeled in red.The current spelling of Chippewa Creek is Chippawa. Although it not possible to make out the entire name of the H. W. Timms hotel located at Front and Bridge Street on the map itself it was discovered to belong to Henry W. Timms after consulting the 1851-52 Canada Directory.
item29,Canal to Chippewa Creek with Port Robinson Map 1,image/jpeg,Canal_Chippewa_Creek_Port_Robinson_1.jpg,,Welland Canal;Survey Map;Chippewa Creek,Port Robinson,,,Survey map of the Second Welland Canal created by the Welland Canal Company showing Port Robinson and the canal to Chippewa Creek. The surveyors' measurements and notes can be seen in red and black ink and pencil. Local area landmarks are also identified and include streets and roads (ex. Front Street: Bridge Street: and Cross Street): the Welland railroad: Dry Dock leased to D. McFarland and Abbey: G. Jordan Tavern: D. McFarland and Co. Burnt Saw Mill: I. Pew Shop: Old Locks: New Lock: Canal to Chippewa Creek: Chippewa Creek: covered drain from dry dock: a barn and several bridges. Properties and property owners of note are: Lots 202: Broken Front lots 202 and 203: D. McFarland and G. Jordan.
item30,Deep Cut and Port Robinson,image/jpeg,Deep_Cut_Port_Robinson.jpg,,Welland Canal;Survey Map;Deep Cut,Port Robinson,,,Survey map of the Second Welland Canal created by the Welland Canal Company showing the canal at Port Robinson. Identified structures and features associated with the Canal include the Deep Cut: Old Channel of Canal and the towing path. The surveyors' measurements and notes can be seen in red and black ink and pencil. Local area landmarks are also identified and include streets and roads (ex. Road to Port Allanburg): the Spoil Bank: an island: several bridges: and a church. Several unidentified structures are present but not labeled. Properties and property owners of note are: Lots 202 203 and 204. Lot 203 is divided into several properties labeled A - J. Owners of these properties include James McCoppen: John Coulter: James Griffith: John C. Jordan: W. Hendershot: John Greer: Charles Richards: C. Stuart: and S. D. Woodruff. Other property owners include D. McFarland.
item31,Deep Cut in Thorold Map 16,image/jpeg,Deep_Cut_Thorold_16.jpg,,Welland Canal;Survey Map;Deep Cut;Thorold,,,,Survey map of the Second Welland Canal created by the Welland Canal Company showing the canal in the Thorold Township between Allanburg and Port Robinson. Identified structures and features associated with the Canal include the Deep Cut and the towing path. The surveyors' measurements and notes can be seen in red and black ink and pencil. Local area landmarks are also identified and include streets and roads (ex. Road to Port Allanburg) and the Spoil Bank. Properties and property owners of note are: Lots 185 186 and 187: J. J. Church and H. Vanderburgh. Four properties adjacent to the canal are outlined in blue and labeled J through M with L and K belonging to John Beatty: M belonging to John Coulter and J belonging to G. Jordan (formerly belonging to John Coleman Jordan).
item32,Lock 26 and Allanburgh,image/jpeg,Lock_26_Allanburg.jpg,,Welland Canal;Survey Map;Lock,Allanburg,,,Survey map of the Second Welland Canal created by the Welland Canal Company showing the canal as it passes through the Village of Allanburgh. Identified structures and features associated with the Canal include Lock 26: a Guard Lock: Lock Tender's House: the New Cut: waste weir: and the towing path. Parts of the old canal are indentified and include Old Lock 36 and 37 and the Old Cut. The surveyors' measurements and notes can be seen in red and black ink and pencil. Local area landmarks are also identified and include streets and roads (ex. Holland Road: Centre Street: Falls Street: Canal Street and Clifton Street): Allanburgh Hotel: Rannies Store: Wright and Duncan Grist Mill: A. Vanderburgh Saw Mill: W. Pennock Shingle Factory: John Harper Tavern: a very delapitated Grist and Saw Mill: store house: a shanty: and a number of other structures - some of which are identified by their owners: A. Vanderburgh: W. Wright: C. Brent and H. Mussen. Properties and property owners of note are: Lots 118 and 119: Captain Creighton and William H. Merritt Jr. A number of small properties labeled 1 through 39 are present and of these 6 - 15 are reserved for a Mill Site and are outlined in red. Several other pieces of land are outlined in blue and belong to: W. B. Hendershot: P. Finlay: W. Wright: and L. Leslie. There is also a piece of land reserved for hydraulic purposes.
item33,Deep Cut in Thorold Map 15,image/jpeg,Deep_Cut_Thorold_15.jpg,,Welland Canal;Survey Map;Deep Cut;Thorold,,,,Survey map of the Second Welland Canal created by the Welland Canal Company showing the canal in the Thorold Township just south of Allanburgh. Identified structures and features associated with the Canal include the Deep Cut and the towing path. The surveyors' measurements and notes can be seen in red and black ink and pencil. Local area landmarks are also identified and include streets and roads (ex. Road to Port Robinson) and the Spoil Bank. Properties and property owners of note are: Lots 142 and 143: John J. Church: Henry Vanderburgh: and Martin Delamatter and G. Coulter.
